{
  "benchmark_family": "contradiction-detection",
  "default_track": "contradiction-multihop",
  "project": "The Marked Bench",
  "purpose": "Give external implementations deterministic prediction vectors and expected score summaries.",
  "release_id": "marked-bench-contradiction-standard-release-0.4.8",
  "release_url": "https://github.com/Martin123132/The-Marked-Bench-/releases/tag/v0.4.8",
  "repository_url": "https://github.com/Martin123132/The-Marked-Bench-",
  "schema": "marked_bench.scoring-compatibility.v1",
  "scoring_contract": {
    "all_case_ids_required_once": true,
    "compare_only_same_suite_hash": true,
    "detector_score_semantics": "Binary contradiction confidence on [0, 1].",
    "overall_score_weights": {
      "binary_detection_f1": 0.2,
      "contradiction_macro_f1": 0.45,
      "coverage_index": 0.1,
      "type_accuracy": 0.25
    },
    "prediction_order_is_ignored": true
  },
  "tracks": [
    {
      "case_count": 23,
      "name": "contradiction",
      "suite_hash": "b47ffc31bef81c2643b6a405e4e511994ba59099eb6637470b6dc4c534aa6baf",
      "suite_id": "marked-bench-contradiction-standard",
      "suite_version": "0.1.1"
    },
    {
      "case_count": 17,
      "name": "contradiction-adversarial",
      "suite_hash": "454c1aff69d5028224549dfc14fd8e6c10818251d0abf8becf36f0856b2dbd67",
      "suite_id": "marked-bench-contradiction-adversarial",
      "suite_version": "0.2.0"
    },
    {
      "case_count": 18,
      "name": "contradiction-multihop",
      "suite_hash": "07a2bb9c0e8356d1cdab98b5b1b35a3c8bd29beff695816dfb151dbb5f6d0d1f",
      "suite_id": "marked-bench-contradiction-multihop",
      "suite_version": "0.3.0"
    },
    {
      "case_count": 18,
      "name": "contradiction-controls",
      "suite_hash": "33a0777f6f93504bde517d922f46c24c1d93992256bfe95b32287695babfb08a",
      "suite_id": "marked-bench-contradiction-controls",
      "suite_version": "0.4.0"
    }
  ],
  "vector_count": 12,
  "vectors": [
    {
      "expected_summary": {
        "binary_detection_f1": 1.0,
        "calibration_brier_score": 0.0,
        "calibration_ece": 0.0,
        "case_count": 23,
        "confusion_matrix": {
          "definitional_violation": {
            "definitional_violation": 3,
            "direct_negation": 0,
            "none": 0,
            "property_mismatch": 0,
            "temporal_conflict": 0,
            "universal_counterexample": 0
          },
          "direct_negation": {
            "definitional_violation": 0,
            "direct_negation": 4,
            "none": 0,
            "property_mismatch": 0,
            "temporal_conflict": 0,
            "universal_counterexample": 0
          },
          "none": {
            "definitional_violation": 0,
            "direct_negation": 0,
            "none": 7,
            "property_mismatch": 0,
            "temporal_conflict": 0,
            "universal_counterexample": 0
          },
          "property_mismatch": {
            "definitional_violation": 0,
            "direct_negation": 0,
            "none": 0,
            "property_mismatch": 3,
            "temporal_conflict": 0,
            "universal_counterexample": 0
          },
          "temporal_conflict": {
            "definitional_violation": 0,
            "direct_negation": 0,
            "none": 0,
            "property_mismatch": 0,
            "temporal_conflict": 3,
            "universal_counterexample": 0
          },
          "universal_counterexample": {
            "definitional_violation": 0,
            "direct_negation": 0,
            "none": 0,
            "property_mismatch": 0,
            "temporal_conflict": 0,
            "universal_counterexample": 3
          }
        },
        "contradiction_macro_f1": 1.0,
        "coverage_index": 1.0,
        "failure_case_ids": [],
        "failure_count": 0,
        "overall_score": 100.0,
        "suite_hash": "b47ffc31bef81c2643b6a405e4e511994ba59099eb6637470b6dc4c534aa6baf",
        "suite_id": "marked-bench-contradiction-standard",
        "suite_version": "0.1.1",
        "type_accuracy": 1.0
      },
      "input_predictions": [
        {
          "case_id": "marked-direct-001",
          "detector_score": 1.0,
          "evidence": [
            "marked-direct-001"
          ],
          "predicted": "direct_negation",
          "rationale": "Scoring compatibility vector: perfect."
        },
        {
          "case_id": "marked-direct-002",
          "detector_score": 1.0,
          "evidence": [
            "marked-direct-002"
          ],
          "predicted": "direct_negation",
          "rationale": "Scoring compatibility vector: perfect."
        },
        {
          "case_id": "marked-direct-003",
          "detector_score": 1.0,
          "evidence": [
            "marked-direct-003"
          ],
          "predicted": "direct_negation",
          "rationale": "Scoring compatibility vector: perfect."
        },
        {
          "case_id": "marked-property-001",
          "detector_score": 1.0,
          "evidence": [
            "marked-property-001"
          ],
          "predicted": "property_mismatch",
          "rationale": "Scoring compatibility vector: perfect."
        },
        {
          "case_id": "marked-property-002",
          "detector_score": 1.0,
          "evidence": [
            "marked-property-002"
          ],
          "predicted": "property_mismatch",
          "rationale": "Scoring compatibility vector: perfect."
        },
        {
          "case_id": "marked-property-003",
          "detector_score": 0.0,
          "evidence": [
            "marked-property-003"
          ],
          "predicted": "none",
          "rationale": "Scoring compatibility vector: perfect."
        },
        {
          "case_id": "marked-definition-001",
          "detector_score": 1.0,
          "evidence": [
            "marked-definition-001"
          ],
          "predicted": "definitional_violation",
          "rationale": "Scoring compatibility vector: perfect."
        },
        {
          "case_id": "marked-definition-002",
          "detector_score": 1.0,
          "evidence": [
            "marked-definition-002"
          ],
          "predicted": "definitional_violation",
          "rationale": "Scoring compatibility vector: perfect."
        },
        {
          "case_id": "marked-definition-003",
          "detector_score": 0.0,
          "evidence": [
            "marked-definition-003"
          ],
          "predicted": "none",
          "rationale": "Scoring compatibility vector: perfect."
        },
        {
          "case_id": "marked-universal-001",
          "detector_score": 1.0,
          "evidence": [
            "marked-universal-001"
          ],
          "predicted": "universal_counterexample",
          "rationale": "Scoring compatibility vector: perfect."
        },
        {
          "case_id": "marked-universal-002",
          "detector_score": 1.0,
          "evidence": [
            "marked-universal-002"
          ],
          "predicted": "universal_counterexample",
          "rationale": "Scoring compatibility vector: perfect."
        },
        {
          "case_id": "marked-universal-003",
          "detector_score": 0.0,
          "evidence": [
            "marked-universal-003"
          ],
          "predicted": "none",
          "rationale": "Scoring compatibility vector: perfect."
        },
        {
          "case_id": "marked-temporal-001",
          "detector_score": 1.0,
          "evidence": [
            "marked-temporal-001"
          ],
          "predicted": "temporal_conflict",
          "rationale": "Scoring compatibility vector: perfect."
        },
        {
          "case_id": "marked-temporal-002",
          "detector_score": 1.0,
          "evidence": [
            "marked-temporal-002"
          ],
          "predicted": "temporal_conflict",
          "rationale": "Scoring compatibility vector: perfect."
        },
        {
          "case_id": "marked-temporal-003",
          "detector_score": 0.0,
          "evidence": [
            "marked-temporal-003"
          ],
          "predicted": "none",
          "rationale": "Scoring compatibility vector: perfect."
        },
        {
          "case_id": "marked-control-001",
          "detector_score": 0.0,
          "evidence": [
            "marked-control-001"
          ],
          "predicted": "none",
          "rationale": "Scoring compatibility vector: perfect."
        },
        {
          "case_id": "marked-control-002",
          "detector_score": 0.0,
          "evidence": [
            "marked-control-002"
          ],
          "predicted": "none",
          "rationale": "Scoring compatibility vector: perfect."
        },
        {
          "case_id": "marked-v011-direct-001",
          "detector_score": 1.0,
          "evidence": [
            "marked-v011-direct-001"
          ],
          "predicted": "direct_negation",
          "rationale": "Scoring compatibility vector: perfect."
        },
        {
          "case_id": "marked-v011-property-001",
          "detector_score": 1.0,
          "evidence": [
            "marked-v011-property-001"
          ],
          "predicted": "property_mismatch",
          "rationale": "Scoring compatibility vector: perfect."
        },
        {
          "case_id": "marked-v011-definition-001",
          "detector_score": 1.0,
          "evidence": [
            "marked-v011-definition-001"
          ],
          "predicted": "definitional_violation",
          "rationale": "Scoring compatibility vector: perfect."
        },
        {
          "case_id": "marked-v011-universal-001",
          "detector_score": 1.0,
          "evidence": [
            "marked-v011-universal-001"
          ],
          "predicted": "universal_counterexample",
          "rationale": "Scoring compatibility vector: perfect."
        },
        {